{"$schema":"http://json-schema.org/draft-07/schema#","type":"object","required":["id","version","description","maturity","notes"],"additionalProperties":false,"properties":{"id":{"enum":["documentation","catalogue","library","application"]},"version":{"type":"integer","minimum":1},"description":{"type":"string","minLength":1},"maturity":{"type":"string","minLength":1},"notes":{"type":"string","minLength":1}}}
